{
  "$schema": "https://raw.githubusercontent.com/carrot-foundation/schemas/refs/heads/main/schemas/ipfs/shared/references/methodology-reference/methodology-reference.schema.json",
  "external_id": "f47ac10b-58cc-4372-a567-0e02b2c3d480",
  "name": "BOLD Carbon (CHâ‚„)",
  "version": "1.3.0",
  "external_url": "https://explore.carrot.eco/document/f47ac10b-58cc-4372-a567-0e02b2c3d480",
  "uri": "ipfs://QmMethodologyHash/bold-carbon-ch4-v1.3.0.pdf"
}

